{
  "schemaVersion": 1,
  "id": "the-standard",
  "version": "2026.10.19.3",
  "channel": "stable",
  "publishedAt": "2026-10-19T09:20:00.000Z",
  "payload": {
    "payloadSchemaVersion": 2,
    "sections": {
      "defaultEnabled": [
        "identity",
        "behavior",
        "reasoning",
        "reasoningBudget",
        "knowledge",
        "document",
        "tools",
        "context",
        "consistency",
        "responseIntegrity",
        "relayAudit",
        "protocol",
        "identifiers",
        "cache",
        "injection",
        "knowledgeCutoff",
        "reasoningIQ",
        "thinkingChain"
      ],
      "items": [
        {
          "id": "identity",
          "label": "Model identity",
          "description": "Asks the target to declare its model family, provider and identifiers, then compares the answer with the requested model and the repository provider mapping.",
          "strategies": ["identity"]
        },
        {
          "id": "behavior",
          "label": "Behavior scenarios",
          "description": "Runs the declarative prompt and response scenarios and compares the observed behavior with the declared expectations.",
          "strategies": ["behavior_scenarios"]
        },
        {
          "id": "reasoning",
          "label": "Reasoning attestation",
          "description": "Checks whether reasoning metadata is present and whether a provider-issued attestation survives a continuation request.",
          "strategies": ["reasoning_attestation"]
        },
        {
          "id": "reasoningBudget",
          "label": "Reasoning budget fingerprint",
          "description": "Compares reasoning-budget observations with the calibrated model families. It is an empirical aid and cannot cryptographically prove a backend identity.",
          "strategies": ["reasoning_budget_fingerprint"]
        },
        {
          "id": "knowledge",
          "label": "Knowledge challenges",
          "description": "Sends the versioned knowledge challenges from the repository packs and scores the expected and uncertainty terms.",
          "strategies": ["knowledge_challenges"]
        },
        {
          "id": "document",
          "label": "Document understanding",
          "description": "Sends a deterministic PDF document prompt and checks whether the answer reflects the supplied document content.",
          "strategies": ["document_understanding"]
        },
        {
          "id": "tools",
          "label": "Tool contract",
          "description": "Checks structured tool calls, argument shape, identifier round-tripping and result handling without executing any external tool.",
          "strategies": ["tool_contract"]
        },
        {
          "id": "context",
          "label": "Context gradient",
          "description": "Increases controlled context across levels and compares the reported input tokens with the required echo and fixed-overhead estimates.",
          "strategies": ["context"]
        },
        {
          "id": "consistency",
          "label": "Response consistency",
          "description": "Repeats the same request with deterministic sampling and compares the sampled answers for drift.",
          "strategies": ["consistency"]
        },
        {
          "id": "responseIntegrity",
          "label": "Response integrity",
          "description": "Compares streaming and non-streaming responses, usage plausibility and long-output equivalence for the same request.",
          "strategies": ["response_integrity"]
        },
        {
          "id": "relayAudit",
          "label": "Relay payload integrity",
          "description": "Checks whether the relay exposes its own prompt wrapping, secret markers or truncated payloads instead of passing the request through.",
          "strategies": ["relay_payload_integrity"]
        },
        {
          "id": "protocol",
          "label": "Protocol conformance",
          "description": "Checks the response envelope, stop reasons, streaming lifecycle and model routing fields required by the declared protocol.",
          "strategies": ["protocol"]
        },
        {
          "id": "identifiers",
          "label": "Identifier conformance",
          "description": "Checks stable identifier prefixes, response identifiers and usage identifiers against the repository provider and model mappings.",
          "strategies": ["identifiers"]
        },
        {
          "id": "cache",
          "label": "Cache reuse",
          "description": "Repeats the same prompt serially and compares reported cache-read and cache-write token accounting across rounds.",
          "strategies": ["cache_reuse"]
        },
        {
          "id": "injection",
          "label": "Injection overhead",
          "description": "Compares the reported input tokens of a baseline request and a deliberately wrapped request to estimate relay-added fixed overhead.",
          "strategies": ["injection_overhead"]
        },
        {
          "id": "knowledgeCutoff",
          "label": "Knowledge cutoff",
          "description": "Runs a serial binary search over rule-declared dated events to report an information window. It is informational, is never scored, and never changes a verdict.",
          "strategies": ["knowledge_cutoff"]
        },
        {
          "id": "web",
          "label": "Web search evidence",
          "description": "Checks whether the target actually executed a web search through a declared protocol-specific tool and returned source URLs.",
          "strategies": ["web_search"]
        },
        {
          "id": "reasoningIQ",
          "label": "Reasoning IQ",
          "description": "Asks eight rule-scored questions with verifiable, unique answers and reports how many final answers were correct. A refusal, a truncation or noise is downgraded, never scored as a wrong answer.",
          "strategies": ["reasoning_iq"]
        },
        {
          "id": "thinkingChain",
          "label": "Thinking chain return",
          "description": "Checks whether the Anthropic messages endpoint returned readable thinking text together with a provider signature. Every other protocol is unobservable and never scored.",
          "strategies": ["thinking_chain"]
        }
      ]
    },
    "engine": {
      "verifiedThreshold": 80.0,
      "inconclusiveThreshold": 55.0,
      "tierMessages": {
        "cryptographic": "A provider-issued reasoning attestation was accepted in a continuation request and combined with protocol checks.",
        "protocol": "The result is based on observed response structure and derived behavior; opaque attestations were not cryptographically validated.",
        "behavioral": "The result is behavioral evidence and must not be read as cryptographic proof."
      }
    },
    "probes": {
      "activation": {
        "behaviorScenarios": {
          "modes": [
            "full"
          ],
          "protocols": [
            "anthropic",
            "openai",
            "gemini"
          ]
        },
        "knowledgeChallenges": {
          "modes": [
            "standard",
            "full"
          ],
          "protocols": [
            "anthropic",
            "openai",
            "gemini"
          ]
        },
        "documentUnderstanding": {
          "modes": [
            "full"
          ],
          "protocols": [
            "anthropic"
          ]
        },
        "toolContract": {
          "modes": [
            "standard",
            "full"
          ],
          "protocols": [
            "anthropic",
            "openai"
          ]
        },
        "toolStrict": {
          "modes": [
            "full"
          ],
          "protocols": [
            "anthropic",
            "openai"
          ]
        },
        "responseIntegrity": {
          "modes": [
            "standard",
            "full"
          ],
          "protocols": [
            "anthropic",
            "openai",
            "gemini"
          ]
        },
        "relayAudit": {
          "modes": [
            "standard",
            "full"
          ],
          "protocols": [
            "anthropic",
            "openai",
            "gemini"
          ]
        },
        "longOutput": {
          "modes": [
            "full"
          ],
          "protocols": [
            "anthropic",
            "openai",
            "gemini"
          ]
        },
        "cache": {
          "modes": [
            "standard",
            "full"
          ],
          "protocols": [
            "anthropic",
            "openai",
            "gemini"
          ]
        },
        "injection": {
          "modes": [
            "quick",
            "standard",
            "full"
          ],
          "protocols": [
            "anthropic",
            "openai",
            "gemini"
          ]
        },
        "knowledgeCutoff": {
          "modes": [
            "full"
          ],
          "protocols": [
            "anthropic",
            "openai",
            "gemini"
          ]
        },
        "webSearch": {
          "modes": [
            "standard",
            "full"
          ],
          "protocols": [
            "anthropic",
            "openai",
            "gemini"
          ]
        },
        "reasoningIQ": {
          "modes": [
            "standard",
            "full"
          ],
          "protocols": [
            "anthropic",
            "openai",
            "gemini"
          ]
        },
        "thinkingChain": {
          "modes": [
            "standard",
            "full"
          ],
          "protocols": [
            "anthropic"
          ]
        }
      },
      "identity": {
        "prompt": "State your exact model family and provider in one sentence.",
        "demoResponseTemplate": "I am {model}, a {family}-family model served by {provider}.",
        "families": [
          {